<?xml version="1.0" encoding="UTF-8"?>
<!--
ACIT 4850
Damian Kim
Pablo Ramos

Course perspective
-->

<!DOCTYPE term4 SYSTEM 'course.dtd'>
<term4>
    <timetable>
        <course id="4850">
            <class type="tutorial" day="Thursday" start="1030" end="1220">
                <name>ACIT 4850</name>
                <instructor>James Perry</instructor>
                <room>SE12 306</room>
            </class>                   
            <class type="lecture" day="Wednesday" start="1230" end="1420">
                <name>ACIT 4850</name>
                <instructor>James Perry</instructor>
                <room>SE12 306</room>
            </class>                           
        </course>
    </timetable>
</term4>
